name,description,prep_time,done
penne arrabiata,penne pasta in a spicy sauce,20 min,false
vegetable curry,indian curry with vegetables,30 min,false
halloumi cheese,halloumi cheese with tomato,11 min,false
Pear cake with orange blossom,"Ingredients : orange, sugar, baking powder, flour, milk, egg, pear, butter. Mix sugar, softened butter and yeast with the milk. Separate the egg yolk from white. Work the previous mixture with flour and egg yolk. Add the orange flower water....",     25 min    50 min,false
tomato salad, tomato  greens cheese,,false
